{
  "schema_version": "1.0",
  "id": "kueche_sonder_2026",
  "name": "Sonderschränke (Beispiel)",
  "kataloge": [
    "../catalog"
  ],
  "standards": {
    "bauweise": "seiten_durchgehend",
    "korpus": {
      "staerke": 19,
      "material": "spano_weiss_19",
      "kante_sichtbar": "abs_weiss_2"
    },
    "front": {
      "staerke": 19,
      "material": "mdf_lack_19",
      "kante": "abs_lack_2",
      "fuge": 3,
      "griff": "grifflos"
    },
    "rueckwand": {
      "art": "aufgesetzt",
      "staerke": 8,
      "material": "hdf_weiss_8"
    },
    "hoehen": {
      "sockel": 100,
      "arbeitsplatte_staerke": 38,
      "arbeitshoehe": 910
    },
    "tiefen": {
      "us": 560,
      "hs": 350,
      "hoch": 560
    },
    "lochreihe": {
      "raster": 32
    },
    "beschlag_set": "haefele_standard",
    "materialien": {
      "spano_weiss_19": {
        "name": "Spanplatte melaminbeschichtet weiß",
        "staerke": 19
      },
      "mdf_lack_19": {
        "name": "MDF lackiert",
        "staerke": 19
      },
      "hdf_weiss_8": {
        "name": "HDF weiß",
        "staerke": 8
      },
      "spano_weiss_16": {
        "name": "Spanplatte melaminbeschichtet weiß 16",
        "staerke": 16
      },
      "spano_wasserfest_19": {
        "name": "Spanplatte wasserfest (V100) weiß 19",
        "staerke": 19
      }
    },
    "kanten": {
      "abs_weiss_2": {
        "name": "ABS weiß 2 mm",
        "staerke": 2,
        "hoehe": 23
      },
      "abs_lack_2": {
        "name": "ABS lackfähig 2 mm",
        "staerke": 2,
        "hoehe": 23
      }
    },
    "maschine": {
      "exporter_profil": "profile/werkstatt.tcnprofil.json"
    },
    "schubkasten": {
      "material": "spano_weiss_16"
    }
  },
  "zeilen": [
    {
      "id": "zeile_b",
      "name": "Zeile B Sonderschränke",
      "ebene": "unten",
      "start": [
        0,
        0,
        0
      ],
      "elemente": [
        {
          "pos": "B1",
          "vorlage": "US-GS-VOLL"
        },
        {
          "pos": "B2",
          "vorlage": "US-GS-TEIL"
        },
        {
          "pos": "B3",
          "vorlage": "US-GS-FREI"
        },
        {
          "pos": "B4",
          "vorlage": "US-SPUE",
          "breite": 900
        },
        {
          "pos": "B5",
          "vorlage": "US-HERD-OFEN"
        },
        {
          "pos": "B6",
          "vorlage": "US-HERD-KF",
          "breite": 800
        },
        {
          "pos": "B7",
          "vorlage": "HS-OFEN"
        },
        {
          "pos": "B8",
          "vorlage": "ES-BLIND-L"
        },
        {
          "pos": "B9",
          "vorlage": "ES-BLIND-R"
        },
        {
          "pos": "B10",
          "vorlage": "ES-L-KARUSSELL"
        },
        {
          "pos": "B11",
          "vorlage": "ES-L-LEMANS"
        },
        {
          "pos": "B12",
          "vorlage": "ES-LR-KARUSSELL"
        },
        {
          "pos": "B13",
          "vorlage": "ES-LR-LEMANS"
        }
      ]
    }
  ]
}
